{
  "schema_version": "1.0.0",
  "approval_id": "44444444-4444-4444-8444-444444444444",
  "approval_type": "PLAN_APPROVAL",
  "status": "APPROVED",
  "requester_user_id": "regulatory-analyst-001",
  "approver_user_id": "qa-reviewer-001",
  "binding": {
    "scope": "SINGLE_PLAN_VERSION",
    "case_id": "11111111-1111-4111-8111-111111111111",
    "current_state_hash": "cccccccccccccccccccccccccccccccccccccccccccccccccccccccccccccccc",
    "plan_id": "33333333-3333-4333-8333-333333333333",
    "plan_version": 1,
    "plan_hash": "bbbbbbbbbbbbbbbbbbbbbbbbbbbbbbbbbbbbbbbbbbbbbbbbbbbbbbbbbbbbbbbb",
    "workflow": {
      "name": "regulatory-impact-review",
      "version": "1.0.0",
      "definition_hash": "cc1db3e1977968774324e17497cb8b5ab93f7aa4099eb6f2cf9e008b1cb0c71c"
    },
    "agent_versions": [
      {
        "name": "regulatory-evidence-agent",
        "version": "1.3.0",
        "definition_hash": "5b19303a147b12c07533523127a58577ff7fe5d27a19413443d7f32a5d775daa"
      }
    ],
    "tool_scopes": [
      {
        "name": "regulatory.get_version",
        "version": "1.0.0",
        "required_scopes": ["regulatory:version:read"]
      },
      {
        "name": "regulatory.get_section",
        "version": "1.0.0",
        "required_scopes": ["regulatory:section:read"]
      },
      {
        "name": "regulatory.get_anchor",
        "version": "1.0.0",
        "required_scopes": ["regulatory:anchor:read"]
      }
    ],
    "data_scope": [
      {
        "case_source_id": "22222222-2222-4222-8222-222222222222",
        "source_version_id": "77777777-7777-4777-8777-777777777777",
        "source_hash": "aaaaaaaaaaaaaaaaaaaaaaaaaaaaaaaaaaaaaaaaaaaaaaaaaaaaaaaaaaaaaaaa"
      }
    ],
    "budget": {
      "max_agent_invocations": 1,
      "max_parallel_agents": 1,
      "max_turns": 8,
      "max_tool_calls": 15,
      "max_correction_loops": 1,
      "max_input_tokens": 100000,
      "max_output_tokens": 12000,
      "max_runtime_seconds": 180,
      "max_cost_usd": 2.0
    }
  },
  "risk_class": "R0",
  "proposed_action": "Execute plan version 1 against only the pinned FDA document version.",
  "affected_assets": [
    {
      "type": "CASE_PLAN",
      "id": "33333333-3333-4333-8333-333333333333",
      "version": 1
    }
  ],
  "supporting_evidence_refs": ["22222222-2222-4222-8222-222222222222"],
  "requested_at": "2026-09-04T01:05:00Z",
  "decided_at": "2026-09-04T01:06:00Z",
  "decision_reason": "Plan scope, source pin, tools, agents, and budget are acceptable for decision-support analysis.",
  "expires_at": "2026-09-05T01:06:00Z",
  "decision_append_only": true
}
